Item Title,Publication Title,Book Series Title,Journal Volume,Journal Issue,Item DOI,Authors,Publication Year,URL,Content Type
"A simple generator for discrete log-concave distributions","Computing","","39","1","10.1007/BF02307716","L. Devroye","1987","http://link.springer.com/article/10.1007/BF02307716","Article"
"Editorial: Human and Machine Learning","Machine Learning","","1","3","10.1023/A:1022854429410","Pat Langley","1986","http://link.springer.com/article/10.1023/A%3A1022854429410","Article"
"Some modifications of the parallel Halley iteration method and their convergence","Computing","","38","1","10.1007/BF02253746","Prof. De-ren WangYu-jiang Wu","1987","http://link.springer.com/article/10.1007/BF02253746","Article"
"Generative design in architecture using an expert system","The Visual Computer","","1","3","10.1007/BF01910018","Eric GullichsenErnest Chang","1985","http://link.springer.com/article/10.1007/BF01910018","Article"
"Comparing knowledge elicitation techniques: a case study","Artificial Intelligence Review","","1","4","10.1007/BF00142925","R. SchweickertA. M. BurtonN. K. TaylorE. N. CorlettN. R. ShadboltA. P. Hedgecock","1987","http://link.springer.com/article/10.1007/BF00142925","Article"
"Color spaces and color contrast","The Visual Computer","","1","3","10.1007/BF01910022","Avi Naiman","1985","http://link.springer.com/article/10.1007/BF01910022","Article"
"Explicit iterative algorithms to reduce a univariate catastrophe to normal form","Computing","","35","1","10.1007/BF02240148","Dr. F. J. WrightDr. G. Dangelmayr","1985","http://link.springer.com/article/10.1007/BF02240148","Article"
"Voronoi diagrams with barriers and on polyhedra for minimal path planning","The Visual Computer","","1","2","10.1007/BF01898357","W. Randolph FranklinVarol AkmanColin Verrilli","1985","http://link.springer.com/article/10.1007/BF01898357","Article"
"On Stetter's global error estimation in the smooth phase of stiff differential equations","Computing","","36","1 - 2","10.1007/BF02238191","S. Scholz","1986","http://link.springer.com/article/10.1007/BF02238191","Article"
"Centered forms and interval operators","Computing","","34","3","10.1007/BF02253320","R. Krawczyk","1985","http://link.springer.com/article/10.1007/BF02253320","Article"
"Animation with fractals from variations on the Mandelbrot set","The Visual Computer","","3","1","10.1007/BF02153648","Thomas V. PapathomasBela Julesz","1987","http://link.springer.com/article/10.1007/BF02153648","Article"
"Events","The Visual Computer","","3","1","10.1007/BF02153652","","1987","http://link.springer.com/article/10.1007/BF02153652","Article"
"Explicit representation of terms defined by counter examples","Journal of Automated Reasoning","","3","3","10.1007/BF00243794","J. -L. LassezK. Marriott","1987","http://link.springer.com/article/10.1007/BF00243794","Article"
"A computational process for choosing the relaxation parameter in nonlinear SOR","Computing","","37","1","10.1007/BF02252731","M. E. BrewsterR. Kannan","1986","http://link.springer.com/article/10.1007/BF02252731","Article"
"Automated deduction by theory resolution","Journal of Automated Reasoning","","1","4","10.1007/BF00244275","Mark E. Stickel","1985","http://link.springer.com/article/10.1007/BF00244275","Article"
"Interpreting line drawings of curved objects","International Journal of Computer Vision","","1","1","10.1007/BF00128527","Jitendra Malik","1987","http://link.springer.com/article/10.1007/BF00128527","Article"
"Machine Learning and Concept Formation","Machine Learning","","2","2","10.1023/A:1022896407371","Pat Langley","1987","http://link.springer.com/article/10.1023/A%3A1022896407371","Article"
"A Lexical-Functional approach to Japanese for the purpose of machine translation","Computers and translation","","1","4","10.1007/BF00936420","Yukiko Sasaki Alam","1986","http://link.springer.com/article/10.1007/BF00936420","Article"
"Schubert's Steamroller problem: Formulations and solutions","Journal of Automated Reasoning","","2","1","10.1007/BF00246025","Mark E. Stickel","1986","http://link.springer.com/article/10.1007/BF00246025","Article"
"CAD system of microprogrammed digital systems","Journal of Computer Science and Technology","","2","3","10.1007/BF02973507","Minghui Li","1987","http://link.springer.com/article/10.1007/BF02973507","Article"
"On artificial intelligence","Artificial Intelligence Review","","1","1","10.1007/BF01988524","J. A. Campbell","1986","http://link.springer.com/article/10.1007/BF01988524","Article"
"On conceptual model specification and verification","Journal of Computer Science and Technology","","2","1","10.1007/BF02943316","Zhenhe Gong","1987","http://link.springer.com/article/10.1007/BF02943316","Article"
"Scientific applications of computer graphics","The Visual Computer","","2","3","10.1007/BF01900338","Melvin L. Prueitt","1986","http://link.springer.com/article/10.1007/BF01900338","Article"
"Visible surface calculation for complex unstructured polygonal scences","Computing","","35","3 - 4","10.1007/BF02240191","Dr. H. MüllerProf. Dr. A. SchmittSt. Abramowski","1985","http://link.springer.com/article/10.1007/BF02240191","Article"
"Throughput models of CSMA network with stations uniformly distributed along the bus","Journal of Computer Science and Technology","","2","4","10.1007/BF02943320","S. T. ChansonL. LiangA. Kumar","1987","http://link.springer.com/article/10.1007/BF02943320","Article"
"Data structures and the time complexity of ray tracing","The Visual Computer","","3","4","10.1007/BF01952827","Isaac D. SchersonElisha Caspary","1987","http://link.springer.com/article/10.1007/BF01952827","Article"
"Editorial","The Visual Computer","","2","4","10.1007/BF01900342","Tosiyasu L. Kunii","1986","http://link.springer.com/article/10.1007/BF01900342","Article"
"Computer Art Forum","The Visual Computer","","3","4","10.1007/BF01952831","","1987","http://link.springer.com/article/10.1007/BF01952831","Article"
"Choosing directions for rules","Journal of Automated Reasoning","","3","4","10.1007/BF00247437","Richard TreitelMichael R. Genesereth","1987","http://link.springer.com/article/10.1007/BF00247437","Article"
"Toward a new age of computing","New Generation Computing","","4","1","10.1007/BF03037379","Kazuhiro Fuchi","1986","http://link.springer.com/article/10.1007/BF03037379","Article"
"A logic-based calculus of events","New Generation Computing","","4","1","10.1007/BF03037383","Robert KowalskiMarek Sergot","1986","http://link.springer.com/article/10.1007/BF03037383","Article"
"Low complexity k-dimensional centered forms","Computing","","37","3","10.1007/BF02252515","J. G. Rokne","1986","http://link.springer.com/article/10.1007/BF02252515","Article"
"Calendar of Events","New Generation Computing","","3","3","10.1007/BF03037128","","1985","http://link.springer.com/article/10.1007/BF03037128","Article"
"Induction of Decision Trees","Machine Learning","","1","1","10.1023/A:1022643204877","J.R. Quinlan","1986","http://link.springer.com/article/10.1023/A%3A1022643204877","Article"
"Information technology and the management of knowledge","AI & SOCIETY","","1","2","10.1007/BF01891270","Henrik Sinding-Larsen","1987","http://link.springer.com/article/10.1007/BF01891270","Article"
"Book reviews","Artificial Intelligence Review","","1","4","10.1007/BF00142927","S. P. RossTony DoddWendy MilneMervyn BennunElpida KeranvouS. J. TurnerS. J. MaskellKathryn SeifertChris AlpheyYasmin MeraliJason CooperSaad A. Mehdi","1987","http://link.springer.com/article/10.1007/BF00142927","Article"
"A study of B-convergence of Runge-Kutta methods","Computing","","36","1 - 2","10.1007/BF02238189","K. BurrageW. H. HundsdorferJ. G. Verwer","1986","http://link.springer.com/article/10.1007/BF02238189","Article"
"Preface to the special issue","New Generation Computing","","5","1","10.1007/BF03037454","Kenneth M. KahnKoichi Furukawa","1987","http://link.springer.com/article/10.1007/BF03037454","Article"
"Deduction in non-Horn databases","Journal of Automated Reasoning","","1","2","10.1007/BF00244994","Adnan YahyaLawrence J. Henschen","1985","http://link.springer.com/article/10.1007/BF00244994","Article"
"A systolic array algorithm for the algebraic path problem (shortest paths; Matrix inversion)","Computing","","34","3","10.1007/BF02253318","Dipl.-Ing. Günter Rote","1985","http://link.springer.com/article/10.1007/BF02253318","Article"
"On the extrapolation for a singularly perturbed boundary value problem","Computing","","36","1 - 2","10.1007/BF02238193","R. VulanovićDr. D. HercegN. Petrović","1986","http://link.springer.com/article/10.1007/BF02238193","Article"
"Some old and new Runge-Kutta formulas with stepsize control and their error coefficients","Computing","","34","3","10.1007/BF02253322","Dr. E. Fehlberg","1985","http://link.springer.com/article/10.1007/BF02253322","Article"
"Low order practical Runge-Kutta-Nyström methods","Computing","","38","4","10.1007/BF02278707","J. M. Fine","1987","http://link.springer.com/article/10.1007/BF02278707","Article"
"Approximation of a set of points by points of a grid","Computing","","38","4","10.1007/BF02278711","Prof. Dr. P. BruckerW. Meyer","1987","http://link.springer.com/article/10.1007/BF02278711","Article"
"Proving self-utterances","Journal of Automated Reasoning","","3","3","10.1007/BF00243796","Michael MillerDonald Perlis","1987","http://link.springer.com/article/10.1007/BF00243796","Article"
"A Remez-type algorithm for the calculation of extremal fundamental systems for polynomial spaces on teh sphere","Computing","","37","1","10.1007/BF02252733","Prof. Dr. M. ReimerDr. B. Sündermann","1986","http://link.springer.com/article/10.1007/BF02252733","Article"
"The bread and butter of planning","Artificial Intelligence Review","","1","3","10.1007/BF00142290","S. Steel","1987","http://link.springer.com/article/10.1007/BF00142290","Article"
"Circumscription and implicit definability","Journal of Automated Reasoning","","1","4","10.1007/BF00244277","Jon Doyle","1985","http://link.springer.com/article/10.1007/BF00244277","Article"
"On intelligent dictionaries","Computers and translation","","1","4","10.1007/BF00936422","Krystyna Wachowicz","1986","http://link.springer.com/article/10.1007/BF00936422","Article"
"Addresses of editor-in-chief and Editorial Board","Journal of Automated Reasoning","","2","1","10.1007/BF00246027","","1986","http://link.springer.com/article/10.1007/BF00246027","Article"
"Engineering artificial intelligence software","Artificial Intelligence Review","","1","1","10.1007/BF01988526","D. Partridge","1986","http://link.springer.com/article/10.1007/BF01988526","Article"
"An interactive system SDI on microcomputer","Journal of Computer Science and Technology","","2","1","10.1007/BF02943318","Renbao ZhongLin XingZhaoyang Ren","1987","http://link.springer.com/article/10.1007/BF02943318","Article"
"In this issue...","Artificial Intelligence Review","","1","1","10.1007/BF01988530","","1986","http://link.springer.com/article/10.1007/BF01988530","Article"
"Symbolic calculation of the trace of the power of a tridiagonal matrix","Computing","","35","3 - 4","10.1007/BF02240193","M. T. Chu","1985","http://link.springer.com/article/10.1007/BF02240193","Article"
"The optimization of distributed join in C-POREL system","Journal of Computer Science and Technology","","2","4","10.1007/BF02943322","Hongping JinJunzhong Gu","1987","http://link.springer.com/article/10.1007/BF02943322","Article"
"Translation separability of sets of polygons","The Visual Computer","","3","4","10.1007/BF01952829","Frank DehneJörg-Rüdiger Sack","1987","http://link.springer.com/article/10.1007/BF01952829","Article"
"Interactive manipulation of three dimensional binary scenes","The Visual Computer","","2","4","10.1007/BF01900344","Sushma S. Trivedi","1986","http://link.springer.com/article/10.1007/BF01900344","Article"
"Case studies of Z-module reasoning: Proving benchmark theorems from ring theory","Journal of Automated Reasoning","","3","4","10.1007/BF00247439","Tie-Cheng Wang","1987","http://link.springer.com/article/10.1007/BF00247439","Article"
"Report on IJCAI-85","New Generation Computing","","4","1","10.1007/BF03037385","Takashi Yokomori","1986","http://link.springer.com/article/10.1007/BF03037385","Article"
"Selection of the optimum uniform partition search","Computing","","37","3","10.1007/BF02252517","A. J. Hu","1986","http://link.springer.com/article/10.1007/BF02252517","Article"
"Editorial","AI & SOCIETY","","1","2","10.1007/BF01891268","","1987","http://link.springer.com/article/10.1007/BF01891268","Article"
"The nurse as an engineer","AI & SOCIETY","","1","2","10.1007/BF01891272","Ingela Josefson","1987","http://link.springer.com/article/10.1007/BF01891272","Article"
"Making exhaustive search programs deterministic","New Generation Computing","","5","1","10.1007/BF03037456","Kazunori Ueda","1987","http://link.springer.com/article/10.1007/BF03037456","Article"
"A class of confluent term rewriting systems and unification","Journal of Automated Reasoning","","2","4","10.1007/BF00248250","Jia-Huai YouP. A. Subrahmanyam","1986","http://link.springer.com/article/10.1007/BF00248250","Article"
"Reasoning about equality","Journal of Automated Reasoning","","1","2","10.1007/BF00244996","E. L. LuskR. A. Overbeek","1985","http://link.springer.com/article/10.1007/BF00244996","Article"
"Extended univariate algorithms for n-dimensional global optimization","Computing","","36","1 - 2","10.1007/BF02238195","Dr. J. Pintér","1986","http://link.springer.com/article/10.1007/BF02238195","Article"
"How to invent a Prolog machine","New Generation Computing","","5","1","10.1007/BF03037460","Peter Kursawe","1987","http://link.springer.com/article/10.1007/BF03037460","Article"
"A converse rule of signs for polynomials","Computing","","34","3","10.1007/BF02253324","A. G. AkritasS. D. Danielopoulos","1985","http://link.springer.com/article/10.1007/BF02253324","Article"
"Computer graphics Tokyo 85","The Visual Computer","","2","2","10.1007/BF01900311","","1986","http://link.springer.com/article/10.1007/BF01900311","Article"
"Distributions of floating point numbers","Computing","","38","4","10.1007/BF02278709","J. K. ScheidtC. W. Schelin","1987","http://link.springer.com/article/10.1007/BF02278709","Article"
"On quartic splines with application to quadratures","Computing","","38","4","10.1007/BF02278713","M. N. El TaraziS. Sallam","1987","http://link.springer.com/article/10.1007/BF02278713","Article"
"Grid methods in simulation and random variate generation","Computing","","37","1","10.1007/BF02252735","L. Devroye","1986","http://link.springer.com/article/10.1007/BF02252735","Article"
"Editorial","Artificial Intelligence Review","","1","3","10.1007/BF00142288","Masoud Yazdani","1987","http://link.springer.com/article/10.1007/BF00142288","Article"
"Editorial","The Visual Computer","","3","2","10.1007/BF02153660","","1987","http://link.springer.com/article/10.1007/BF02153660","Article"
"Teaching strategies and tactics in intelligent computer aided instruction","Artificial Intelligence Review","","1","3","10.1007/BF00142292","L. Ford","1987","http://link.springer.com/article/10.1007/BF00142292","Article"
"Predicate logic hacker tricks","Journal of Automated Reasoning","","1","4","10.1007/BF00244279","Hans Jūrgen Ohlbach","1985","http://link.springer.com/article/10.1007/BF00244279","Article"
"The French National MT-Project: Technical organization and translation results of CALLIOPE-AERO","Computers and translation","","1","4","10.1007/BF00936424","Christian Boitet","1986","http://link.springer.com/article/10.1007/BF00936424","Article"
"Slip intoLISP: How to choose aLISP interpreter","Artificial Intelligence Review","","1","1","10.1007/BF01988528","A. Narayanan","1986","http://link.springer.com/article/10.1007/BF01988528","Article"
"Performance evaluations of recursive and iterative algorithms for the Towers of Hanoi problem","Computing","","37","2","10.1007/BF02253184","M. C. Er","1986","http://link.springer.com/article/10.1007/BF02253184","Article"
"Computing simple bifurcation points using a minimally extended system of nonlinear equations","Computing","","35","3 - 4","10.1007/BF02240195","Dr. Gerd Pönisch","1985","http://link.springer.com/article/10.1007/BF02240195","Article"
"The BC-chain method for representing combinators in linear space","New Generation Computing","","3","2","10.1007/BF03037065","Kohei NoshitaTeruo Hikita","1985","http://link.springer.com/article/10.1007/BF03037065","Article"
"A real-time interprocessor synchronization algorithm for communication in distributed computer systems","Journal of Computer Science and Technology","","2","4","10.1007/BF02943324","Ping DuanXiyao Cai","1987","http://link.springer.com/article/10.1007/BF02943324","Article"
"Data structure forsoft objects","The Visual Computer","","2","4","10.1007/BF01900346","Geoff WyvillCraig McPheetersBrian Wyvill","1986","http://link.springer.com/article/10.1007/BF01900346","Article"
"Computer Art Forum","The Visual Computer","","2","4","10.1007/BF01900350","Nadia Magnenat Thalmann","1986","http://link.springer.com/article/10.1007/BF01900350","Article"
"Efficient solutions of hierarchical systems of linear equations","Computing","","39","2","10.1007/BF02310101","Th. LengauerCh. Wieners","1987","http://link.springer.com/article/10.1007/BF02310101","Article"
"Calendar of events","New Generation Computing","","4","1","10.1007/BF03037387","","1986","http://link.springer.com/article/10.1007/BF03037387","Article"
"An elementary noniterative quadrature-type method for the numerical solution of a nonlinear equation","Computing","","37","3","10.1007/BF02252519","Prof. Dr. N. I. IoakimidisMrs. E. G. Anastasselou","1986","http://link.springer.com/article/10.1007/BF02252519","Article"
"AID: An alternative implementation of DCGs","New Generation Computing","","4","4","10.1007/BF03037391","Ulf Nilsson","1986","http://link.springer.com/article/10.1007/BF03037391","Article"
"Editorial announcement A new column: Basic research problems","Journal of Automated Reasoning","","2","4","10.1007/BF00248248","","1986","http://link.springer.com/article/10.1007/BF00248248","Article"
"Habemus talpam!","AI & SOCIETY","","1","2","10.1007/BF01891274","David Smith","1987","http://link.springer.com/article/10.1007/BF01891274","Article"
"A parallel parsing system for natural language analysis","New Generation Computing","","5","1","10.1007/BF03037458","Yuji Matsumoto","1987","http://link.springer.com/article/10.1007/BF03037458","Article"
"Announcement","Journal of Automated Reasoning","","2","4","10.1007/BF00248252","","1986","http://link.springer.com/article/10.1007/BF00248252","Article"
"Changes of address","Journal of Automated Reasoning","","1","2","10.1007/BF00244998","","1985","http://link.springer.com/article/10.1007/BF00244998","Article"
"Zur Berechnung von Lösungen konsistenter linearer Gleichungssysteme mit singulärer Koeffizientenmatrix","Computing","","36","1 - 2","10.1007/BF02238197","Dr. V. Drygalla","1986","http://link.springer.com/article/10.1007/BF02238197","Article"
"On semantical issues of information","New Generation Computing","","5","3","10.1007/BF03037462","Takayasu Ito","1987","http://link.springer.com/article/10.1007/BF03037462","Article"
"Graphics interface tool development in a problem solving environment","The Visual Computer","","2","2","10.1007/BF01900313","Kenneth I. Joy","1986","http://link.springer.com/article/10.1007/BF01900313","Article"
"A simple proof of the validity of the reduced prs algorithm","Computing","","38","4","10.1007/BF02278715","A. G. Akritas","1987","http://link.springer.com/article/10.1007/BF02278715","Article"
"The simulation of natural features using cone tracing","The Visual Computer","","3","2","10.1007/BF02153662","David B. Kirk","1987","http://link.springer.com/article/10.1007/BF02153662","Article"
"Accidental nuclear war: the contribution of artificial intelligence","Artificial Intelligence Review","","1","3","10.1007/BF00142294","M. YazdaniB. Whitby","1987","http://link.springer.com/article/10.1007/BF00142294","Article"
"Experimental goal regression: A method for learning problem-solving heuristics","Machine Learning","","1","3","10.1007/BF00116893","Bruce W. PorterDennis F. Kibler","1986","http://link.springer.com/article/10.1007/BF00116893","Article"
"Zbigniew L. Pankowicz: An appreciation","Computers and translation","","1","4","10.1007/BF00936426","Bernard E. Scott","1986","http://link.springer.com/article/10.1007/BF00936426","Article"
"Helmut Werner","Computing","","36","1 - 2","10.1007/BF02238200","","1986","http://link.springer.com/article/10.1007/BF02238200","Article"
"A method for preconditioning matrices arising from linear integral equations for elliptic boundary value problems","Computing","","37","2","10.1007/BF02253186","Lothar Reichel","1986","http://link.springer.com/article/10.1007/BF02253186","Article"
"An adaptive multi-grid algorithm for the numerical solution of quasilinear potential equations","Computing","","35","3 - 4","10.1007/BF02240197","M. S. Abou El-Seoud","1985","http://link.springer.com/article/10.1007/BF02240197","Article"
"Internal consistency in plausible reasoning systems","New Generation Computing","","3","2","10.1007/BF03037067","J. R. Quinlan","1985","http://link.springer.com/article/10.1007/BF03037067","Article"
"An online diagnosable fault-tolerant redundancy system","Journal of Computer Science and Technology","","2","4","10.1007/BF02943326","Weigeng ShiStephen Y. H. Su","1987","http://link.springer.com/article/10.1007/BF02943326","Article"
"Pixelated structures as a compositional medium","The Visual Computer","","2","4","10.1007/BF01900348","Ranjit Makkuni","1986","http://link.springer.com/article/10.1007/BF01900348","Article"
"Signal matching through scale space","International Journal of Computer Vision","","1","2","10.1007/BF00123162","Andrew WitkinDemetri TerzopoulosMichael Kass","1987","http://link.springer.com/article/10.1007/BF00123162","Article"
"A class of interval-Newton-operators","Computing","","37","2","10.1007/BF02253190","Prof. Dr. R. Krawczyk","1986","http://link.springer.com/article/10.1007/BF02253190","Article"
"Report on the Workshop on Object-Oriented Computing","New Generation Computing","","3","2","10.1007/BF03037071","Norihisa Suzuki","1985","http://link.springer.com/article/10.1007/BF03037071","Article"
"Editorial","The Visual Computer","","1","1","10.1007/BF01901263","Tosiyasu L. Kunii","1985","http://link.springer.com/article/10.1007/BF01901263","Article"
"On computer generation of random vectors by transformations of uniformly distributed vectors","Computing","","39","2","10.1007/BF02310103","S. StefąnescuI. Vąduva","1987","http://link.springer.com/article/10.1007/BF02310103","Article"
"Adapting combinator and SECD machines to display snapshots of functional computations","New Generation Computing","","4","4","10.1007/BF03037389","Ian ToynColin Runciman","1986","http://link.springer.com/article/10.1007/BF03037389","Article"
"Editorial","Journal of Computer Science and Technology","","1","1","10.1007/BF02943294","Peisu Xia","1986","http://link.springer.com/article/10.1007/BF02943294","Article"
"Report on the Third International Conference on Logic Programming","New Generation Computing","","4","4","10.1007/BF03037393","Taisuke Sato","1986","http://link.springer.com/article/10.1007/BF03037393","Article"
"News and Notes","Machine Learning","","2","2","10.1023/A:1022856709189","","1987","http://link.springer.com/article/10.1023/A%3A1022856709189","Article"
"An orthogonal systolic array for the algebraic path problem","Computing","","39","3","10.1007/BF02309554","Y. RobertD. Trystram","1987","http://link.springer.com/article/10.1007/BF02309554","Article"
"Accelerating Krawczyk-like interval algorithms for the solution of nonlinear systems of equations by using second derivatives","Computing","","35","3 - 4","10.1007/BF02240200","Dr. H. Schwandt","1985","http://link.springer.com/article/10.1007/BF02240200","Article"
"The toad work","AI & SOCIETY","","1","2","10.1007/BF01891276","David Smith","1987","http://link.springer.com/article/10.1007/BF01891276","Article"
"Induction of decision trees","Machine Learning","","1","1","10.1007/BF00116251","J. R. Quinlan","1986","http://link.springer.com/article/10.1007/BF00116251","Article"
"Book reviews","AI & SOCIETY","","1","2","10.1007/BF01891280","David InmanDr. C. W. BoyneMike Cooley","1987","http://link.springer.com/article/10.1007/BF01891280","Article"
"On the R-order of some recurrences with applications to inclusion-methods","Computing","","36","1 - 2","10.1007/BF02238199","Prof. Dr. Jürgen Herzberger","1986","http://link.springer.com/article/10.1007/BF02238199","Article"
"Set abstraction—An extension of all solutions predicate in logic programming language","New Generation Computing","","5","3","10.1007/BF03037464","Takashi Yokomori","1987","http://link.springer.com/article/10.1007/BF03037464","Article"
"CrossoverNet: A computer graphics/ video crossover LAN system","The Visual Computer","","2","2","10.1007/BF01900315","Tosiyasu L. KuniiYukari Shirota","1986","http://link.springer.com/article/10.1007/BF01900315","Article"
"Theory Change via View Application in Instructionless Learning","Machine Learning","","2","3","10.1023/A:1022659315124","Jeff Shrager","1987","http://link.springer.com/article/10.1023/A%3A1022659315124","Article"
"Linguistic and extra-linguistic knowledge","Computers and translation","","1","3","10.1007/BF00935016","Klaus Schubert","1986","http://link.springer.com/article/10.1007/BF00935016","Article"
"As the generations pass...","Computers and translation","","1","3","10.1007/BF00935020","Veronica Lawson","1986","http://link.springer.com/article/10.1007/BF00935020","Article"
