Item Title,Publication Title,Book Series Title,Journal Volume,Journal Issue,Item DOI,Authors,Publication Year,URL,Content Type
"Automating map production of the 1981 Census data for Brighton and Hove, England","The Visual Computer","","3","2","10.1007/BF02153664","T. J. BrowneA. J. Fielding","1987","http://link.springer.com/article/10.1007/BF02153664","Article"
"Elimination of redundant operations in relational queries with general selection operators","Computing","","34","4","10.1007/BF02251832","Mila E. Majster-Cederbaum","1985","http://link.springer.com/article/10.1007/BF02251832","Article"
"A subgradient selection method for minimizing convex functions subject to linear constraints","Computing","","39","4","10.1007/BF02239973","Dr. Kryzstof C. Kiwiel","1987","http://link.springer.com/article/10.1007/BF02239973","Article"
"Editorial: A journal is born","Journal of Automated Reasoning","","1","1","10.1007/BF00244287","Larry Wos","1985","http://link.springer.com/article/10.1007/BF00244287","Article"
"Incremental learning from noisy data","Machine Learning","","1","3","10.1007/BF00116895","Jeffrey C. SchlimmerRichard H. Granger Jr.","1986","http://link.springer.com/article/10.1007/BF00116895","Article"
"Non-horn problems","Journal of Automated Reasoning","","1","1","10.1007/BF00244291","Ewing LuskRoss Overbeek","1985","http://link.springer.com/article/10.1007/BF00244291","Article"
"An intervalal gorithm for solving systems of linear equations to prespecified accuracy","Computing","","34","2","10.1007/BF02259840","J. W. DemmelProf. F. Krückeberg","1985","http://link.springer.com/article/10.1007/BF02259840","Article"
"Chunking in Soar: The Anatomy of a General Learning Mechanism","Machine Learning","","1","1","10.1023/A:1022639103969","John E. LairdPaul S. RosenbloomAllen Newell","1986","http://link.springer.com/article/10.1023/A%3A1022639103969","Article"
"Determining Arguments of Invariant Functional Descriptions","Machine Learning","","1","4","10.1023/A:1022818816206","Mieczyslaw M. Kokar","1986","http://link.springer.com/article/10.1023/A%3A1022818816206","Article"
"On the globalization of Wilson-type optimization methods by means of generalized reduced gradient methods","Computing","","37","2","10.1007/BF02253188","Doz. Dr. V. S. IshutkinDr. K. Schönefeld","1986","http://link.springer.com/article/10.1007/BF02253188","Article"
"On the approximate computation of certain strongly singular integrals","Computing","","35","3 - 4","10.1007/BF02240199","P. Linz","1985","http://link.springer.com/article/10.1007/BF02240199","Article"
"Editorial: Machine Learning and Discovery","Machine Learning","","1","4","10.1023/A:1022814715297","Pat LangleyRyszard S. Michalski","1986","http://link.springer.com/article/10.1023/A%3A1022814715297","Article"
"Architecture of a Reduction-Based Parallel Inference Machine: PIM-R","New Generation Computing","","3","2","10.1007/BF03037069","Rikio OnaiMoritoshi AsoHajime ShimizuKanae MasudaAkira Matsumoto","1985","http://link.springer.com/article/10.1007/BF03037069","Article"
"Using Canny's criteria to derive a recursively implemented optimal edge detector","International Journal of Computer Vision","","1","2","10.1007/BF00123164","Rachid Deriche","1987","http://link.springer.com/article/10.1007/BF00123164","Article"
"Announcement","New Generation Computing","","3","2","10.1007/BF03037073","","1985","http://link.springer.com/article/10.1007/BF03037073","Article"
"A functional model for constructive solid geometry","The Visual Computer","","1","1","10.1007/BF01901265","Geoff WyvillTosiyasu L. Kunii","1985","http://link.springer.com/article/10.1007/BF01901265","Article"
"A Theory of Historical Discovery: The Construction of Componential Models","Machine Learning","","1","1","10.1023/A:1022695221716","Jan M. ZytkowHerbert A. Simon","1986","http://link.springer.com/article/10.1023/A%3A1022695221716","Article"
"A routing algorithm for distributed optimal double loop computer networks","Journal of Computer Science and Technology","","2","2","10.1007/BF02973487","Layuan Li","1987","http://link.springer.com/article/10.1007/BF02973487","Article"
"Order statistics and the linear assignment problem","Computing","","39","2","10.1007/BF02310105","J. B. G. FrenkM. van HouweningeA. H. G. Rinnooy Kan","1987","http://link.springer.com/article/10.1007/BF02310105","Article"
"Two algorithms for variable allocation in an Interpreted Scheme","Journal of Computer Science and Technology","","2","2","10.1007/BF02973491","Weiming Lu","1987","http://link.springer.com/article/10.1007/BF02973491","Article"
"Two varieties of finite automaton public key cryptosystem and digital signatures","Journal of Computer Science and Technology","","1","1","10.1007/BF02943296","Renji TaoShihua Chen","1986","http://link.springer.com/article/10.1007/BF02943296","Article"
"Fuzzy logic in man-machine systems","New Generation Computing","","5","2","10.1007/BF03037395","Toshiro Terano","1987","http://link.springer.com/article/10.1007/BF03037395","Article"
"A free boundary value problem for water invading an unsaturated medium","Computing","","38","3","10.1007/BF02240095","A. KharabR. B. Guenther","1987","http://link.springer.com/article/10.1007/BF02240095","Article"
"The lexicon in the background","Computers and translation","","1","2","10.1007/BF00936467","Sally Yeates SedelowWalter A. Sedelow Jr.","1986","http://link.springer.com/article/10.1007/BF00936467","Article"
"Mean value analysis of closed queueing networks with Erlang service time distributions","Computing","","39","3","10.1007/BF02309556","I. F. Akyildiz","1987","http://link.springer.com/article/10.1007/BF02309556","Article"
"A remark on Frank matrices","Computing","","35","3 - 4","10.1007/BF02240202","J-Fr Hake","1985","http://link.springer.com/article/10.1007/BF02240202","Article"
"Computer aided translation project, University Sains Malaysia, Penang, Malaysia","Computers and translation","","1","2","10.1007/BF00936471","Udom Warotamasikkhadit","1986","http://link.springer.com/article/10.1007/BF00936471","Article"
"Chunking in Soar: The anatomy of a general learning mechanism","Machine Learning","","1","1","10.1007/BF00116249","John E. LairdPaul S. RosenbloomAllen Newell","1986","http://link.springer.com/article/10.1007/BF00116249","Article"
"Numerical computation of Tricomi's psi function by the trapezoidal rule","Computing","","39","3","10.1007/BF02309560","Prof. G. AllasiaDr. R. Besenghi","1987","http://link.springer.com/article/10.1007/BF02309560","Article"
"Trade unions and technology: A volatile mixture","AI & SOCIETY","","1","2","10.1007/BF01891278","Ian Jones","1987","http://link.springer.com/article/10.1007/BF01891278","Article"
"Editorial","The Visual Computer","","2","5","10.1007/BF02020426","David F. RogersRoy Hall","1986","http://link.springer.com/article/10.1007/BF02020426","Article"
"On parallel unification for Prolog","New Generation Computing","","5","3","10.1007/BF03037466","James HarlandJoxan Jaffar","1987","http://link.springer.com/article/10.1007/BF03037466","Article"
"The back-buffer algorithm: An extension of the radiosity method to dynamic environments","The Visual Computer","","2","5","10.1007/BF02020430","Daniel R. BaumJohn R. WallaceMichael F. CohenDonald P. Greenberg","1986","http://link.springer.com/article/10.1007/BF02020430","Article"
"Automatic dyschromatopsia test","The Visual Computer","","2","2","10.1007/BF01900317","Hiroshi MienoGiichi TomizawaYooichiro BanKooichi TakahashiLumi Tatsuta","1986","http://link.springer.com/article/10.1007/BF01900317","Article"
"Events","The Visual Computer","","2","2","10.1007/BF01900321","","1986","http://link.springer.com/article/10.1007/BF01900321","Article"
"Rosenbrock methods for Stiff ODEs: A comparison of Richardson extrapolation and embedding technique","Computing","","34","1","10.1007/BF02242171","P. KapsS. W. H. PoonT. D. Bui","1985","http://link.springer.com/article/10.1007/BF02242171","Article"
"The translation method of Rosetta","Computers and translation","","1","3","10.1007/BF00935018","R. LeermakersJ. Rous","1986","http://link.springer.com/article/10.1007/BF00935018","Article"
"A new space subdivision method for ray tracing CSG modelled scenes","The Visual Computer","","3","2","10.1007/BF02153666","Bruno ArnaldiThierry PriolKadi Bouatouch","1987","http://link.springer.com/article/10.1007/BF02153666","Article"
"Probabilistic error analysis of gaussian elimination in floating point and logarithmic arithmetic","Computing","","34","4","10.1007/BF02251834","J. L. BarlowE. H. Bareiss","1985","http://link.springer.com/article/10.1007/BF02251834","Article"
"A cutting plane algorithm for minimum perfect 2-matchings","Computing","","39","4","10.1007/BF02239975","Martin GrötschelOlaf Holland","1987","http://link.springer.com/article/10.1007/BF02239975","Article"
"ROGET: A knowledge-based system for acquiring the conceptual structure of a diagnostic expert system","Journal of Automated Reasoning","","1","1","10.1007/BF00244289","James S. Bennett","1985","http://link.springer.com/article/10.1007/BF00244289","Article"
"Automatically determining symmetries of partial differential equations","Computing","","34","2","10.1007/BF02259838","F. Schwarz","1985","http://link.springer.com/article/10.1007/BF02259838","Article"
"A routing algorithm with candidate shortest path","Journal of Computer Science and Technology","","1","3","10.1007/BF02979461","Qijing Pan","1986","http://link.springer.com/article/10.1007/BF02979461","Article"
"Functional considerations in the postediting of machine-translated output","Computers and translation","","1","1","10.1007/BF00940826","Muriel Vasconcellos","1986","http://link.springer.com/article/10.1007/BF00940826","Article"
"Asynchronous algorithms for poisson's equation with nonlinear boundary conditions","Computing","","34","2","10.1007/BF02259842","M. N. AnwarM. N. El Tarazi","1985","http://link.springer.com/article/10.1007/BF02259842","Article"
"As the generations pass...","Computers and translation","","1","1","10.1007/BF00940830","Veronica Lawson","1986","http://link.springer.com/article/10.1007/BF00940830","Article"
"Guest editors’ preface","New Generation Computing","","3","4","10.1007/BF03037075","Fumio MizoguchiKoichi Furukawa","1985","http://link.springer.com/article/10.1007/BF03037075","Article"
"Time-slot assignment for TDMA-systems","Computing","","35","2","10.1007/BF02260498","R. E. Burkard","1985","http://link.springer.com/article/10.1007/BF02260498","Article"
"A viewing pipeline for discrete solid modeling","The Visual Computer","","1","1","10.1007/BF01901267","Klaus KronlofMarkku Tamminen","1985","http://link.springer.com/article/10.1007/BF01901267","Article"
"A general and formal method for the program static analysis","Journal of Computer Science and Technology","","2","2","10.1007/BF02973489","Luoming Hou","1987","http://link.springer.com/article/10.1007/BF02973489","Article"
"Remarks on the interval version of Schulz's method","Computing","","39","2","10.1007/BF02310107","Prof. Dr. J. Herzberger","1987","http://link.springer.com/article/10.1007/BF02310107","Article"
"The British Term Bank project: A prototype software","Computers and translation","","2","1","10.1007/BF01540130","Richard Candeland","1987","http://link.springer.com/article/10.1007/BF01540130","Article"
"The Duodirun Merging Algorithm","Journal of Computer Science and Technology","","2","2","10.1007/BF02973493","Zhijie Zheng","1987","http://link.springer.com/article/10.1007/BF02973493","Article"
"Design of a vector processor","Journal of Computer Science and Technology","","1","1","10.1007/BF02943298","Qi Lin","1986","http://link.springer.com/article/10.1007/BF02943298","Article"
"The Recursive Resolution method for Modal Logic","New Generation Computing","","5","2","10.1007/BF03037397","Man-chung Chan","1987","http://link.springer.com/article/10.1007/BF03037397","Article"
"An algorithm for solving multi-point boundary value problems","Computing","","38","3","10.1007/BF02240097","F. R. de HoogR. M. M. Mattheij","1987","http://link.springer.com/article/10.1007/BF02240097","Article"
"Semantics, translation, and anaphora","Computers and translation","","1","2","10.1007/BF00936469","Rebecca Root","1986","http://link.springer.com/article/10.1007/BF00936469","Article"
"Interval Taylor forms","Computing","","39","3","10.1007/BF02309558","J. G. RokneP. Bao","1987","http://link.springer.com/article/10.1007/BF02309558","Article"
"Graph isomorphism and theorems of Birkhoff type","Computing","","36","4","10.1007/BF02240204","Prof. Dr. G. Tinhofer","1986","http://link.springer.com/article/10.1007/BF02240204","Article"
"Sprachnormen: Theorie und Praxis","Computers and translation","","1","2","10.1007/BF00936473","Richard K. Watt","1986","http://link.springer.com/article/10.1007/BF00936473","Article"
"Dispersive refraction in ray tracing","The Visual Computer","","2","1","10.1007/BF01890982","Spencer W. Thomas","1986","http://link.springer.com/article/10.1007/BF01890982","Article"
"Incremental Learning from Noisy Data","Machine Learning","","1","3","10.1023/A:1022810614389","Jeffrey C. SchlimmerRichard H. Granger Jr.","1986","http://link.springer.com/article/10.1023/A%3A1022810614389","Article"
"Accurate arithmetic results for decimal data on non-decimal computers","Computing","","35","2","10.1007/BF02260501","Dr. W. AuzingerProf. Dr. H. J. Stetter","1985","http://link.springer.com/article/10.1007/BF02260501","Article"
"Tutorial on color science","The Visual Computer","","2","5","10.1007/BF02020428","Gary W. Meyer","1986","http://link.springer.com/article/10.1007/BF02020428","Article"
"Texture mapping and distortion in digital graphics","The Visual Computer","","2","5","10.1007/BF02020432","Marcel SamekCheryl SleanHank Weghorst","1986","http://link.springer.com/article/10.1007/BF02020432","Article"
"Theory change via view application in instructionless learning","Machine Learning","","2","3","10.1007/BF00058681","Jeff Shrager","1987","http://link.springer.com/article/10.1007/BF00058681","Article"
"Techniques in computer art","The Visual Computer","","2","2","10.1007/BF01900319","Mutsuko K. SasakiTateaki Sasaki","1986","http://link.springer.com/article/10.1007/BF01900319","Article"
"A structural operational semantics for an Edison-like language (1)","Journal of Computer Science and Technology","","1","1","10.1007/BF02943301","Wei Li","1986","http://link.springer.com/article/10.1007/BF02943301","Article"
"People places things","The Visual Computer","","2","3","10.1007/BF01900323","Nancy H. McDonald","1986","http://link.springer.com/article/10.1007/BF01900323","Article"
"On solving nonlinear least-squares problems in case of rankdeficient Jacobians","Computing","","34","1","10.1007/BF02242173","Dr. R. Menzel","1985","http://link.springer.com/article/10.1007/BF02242173","Article"
"Positive interpolation with rational quadratic splines","Computing","","38","3","10.1007/BF02240100","J. W. SchmidtW. Heß","1987","http://link.springer.com/article/10.1007/BF02240100","Article"
"Events","The Visual Computer","","3","2","10.1007/BF02153668","","1987","http://link.springer.com/article/10.1007/BF02153668","Article"
"Some techniques for solving linear equation systems with guarantee","Computing","","34","4","10.1007/BF02251836","W. HahnK. MohrU. Schauer","1985","http://link.springer.com/article/10.1007/BF02251836","Article"
"Connectionist AI, symbolic AI, and the brain","Artificial Intelligence Review","","1","2","10.1007/BF00130011","P. Smolensky","1987","http://link.springer.com/article/10.1007/BF00130011","Article"
"Implicit Runge-Kutta formulae with built-in estimates of the accumulated truncation error","Computing","","39","4","10.1007/BF02239977","Prof. Dr. W. R. Richert","1987","http://link.springer.com/article/10.1007/BF02239977","Article"
"Vector computer 757","Journal of Computer Science and Technology","","1","3","10.1007/BF02979459","Qingshi GaoXiang ZhangShufan YangShuqing Chen","1986","http://link.springer.com/article/10.1007/BF02979459","Article"
"Machine learning and grammar induction","Machine Learning","","2","1","10.1007/BF00058752","Pat Langley","1987","http://link.springer.com/article/10.1007/BF00058752","Article"
"Kernel language KLND","Journal of Computer Science and Technology","","1","3","10.1007/BF02979463","Cui ZhangQinping ZhaoJiafu Xu","1986","http://link.springer.com/article/10.1007/BF02979463","Article"
"A step towards complementary programming","New Generation Computing","","3","1","10.1007/BF03037113","Takayasu Ito","1985","http://link.springer.com/article/10.1007/BF03037113","Article"
"Book reviews","Computers and translation","","1","1","10.1007/BF00940828","Morgaret WoodruffJohn White","1986","http://link.springer.com/article/10.1007/BF00940828","Article"
"Local error estimation by doubling","Computing","","34","2","10.1007/BF02259844","L. F. Shampine","1985","http://link.springer.com/article/10.1007/BF02259844","Article"
"Integrating discourse pragmatics and propositional knowledge for multilingual natural language processing","Computers and translation","","2","2 - 3","10.1007/BF02274440","Sergei NirenburgJaime Carbonell","1987","http://link.springer.com/article/10.1007/BF02274440","Article"
"Correctness criteria of some algorithms for uncertain reasoning using Incidence Calculus","Journal of Automated Reasoning","","2","2","10.1007/BF02432147","Alan Bundy","1986","http://link.springer.com/article/10.1007/BF02432147","Article"
"Meta-level programming and knowledge representation","New Generation Computing","","3","4","10.1007/BF03037077","Kenneth A. Bowen","1985","http://link.springer.com/article/10.1007/BF03037077","Article"
"Seventy-five problems for testing automatic theorem provers","Journal of Automated Reasoning","","2","2","10.1007/BF02432151","Francis Jeffry Pelletier","1986","http://link.springer.com/article/10.1007/BF02432151","Article"
"Chemical ideograms and molecular computer graphics","The Visual Computer","","1","1","10.1007/BF01901269","J. E. DuboisD. LaurentJ. Weber","1985","http://link.springer.com/article/10.1007/BF01901269","Article"
"Ten requirements for a theory of change","New Generation Computing","","3","4","10.1007/BF03037081","Yoav Shoham","1985","http://link.springer.com/article/10.1007/BF03037081","Article"
"Editorial","AI & SOCIETY","","1","1","10.1007/BF01905884","","1987","http://link.springer.com/article/10.1007/BF01905884","Article"
"Editorial","The Visual Computer","","2","6","10.1007/BF01952417","Tosiyasu L. Kunii","1986","http://link.springer.com/article/10.1007/BF01952417","Article"
"Machine translation output and translation theory","Computers and translation","","2","1","10.1007/BF01540132","Nadeshda K. Riabtseva","1987","http://link.springer.com/article/10.1007/BF01540132","Article"
"Grid stage modelling functions and molecular vector graphics","The Visual Computer","","2","6","10.1007/BF01952421","J. E. DuboisS. Y. YueJ. P. Doucet","1986","http://link.springer.com/article/10.1007/BF01952421","Article"
"The mathematics of computer graphics","The Visual Computer","","3","3","10.1007/BF01962892","Rae A. Earnshaw","1987","http://link.springer.com/article/10.1007/BF01962892","Article"
"On a modification of the QZ algorithm with fast givens rotations","Computing","","38","3","10.1007/BF02240099","H. P. Märchy","1987","http://link.springer.com/article/10.1007/BF02240099","Article"
"Splitting methods for fourth order parabolic partial differential equations","Computing","","37","4","10.1007/BF02251091","E. J. W. ter Maten","1986","http://link.springer.com/article/10.1007/BF02251091","Article"
"Algorithms for brush movement","The Visual Computer","","1","4","10.1007/BF02021811","Kenneth P. FishkinBrian A. Barsky","1985","http://link.springer.com/article/10.1007/BF02021811","Article"
"The METAL English-to-German system: First progress report","Computers and translation","","2","4","10.1007/BF01682180","Jocelyn LiuJoseph Liro","1987","http://link.springer.com/article/10.1007/BF01682180","Article"
"An O(n) bin-packing algorithm for uniformly distributed data","Computing","","36","4","10.1007/BF02240206","J. CsirikG. Galambos","1986","http://link.springer.com/article/10.1007/BF02240206","Article"
"A menu generator for audio visual networks","The Visual Computer","","2","1","10.1007/BF01890984","Tosiyasu L. KuniiYukari ShirotaTsukasa Noma","1986","http://link.springer.com/article/10.1007/BF01890984","Article"
"Editorial: On Machine Learning","Machine Learning","","1","1","10.1023/A:1022687019898","Pat Langley","1986","http://link.springer.com/article/10.1023/A%3A1022687019898","Article"
"A compact variable metric algorithm for nonlinear minimax approximation","Computing","","36","4","10.1007/BF02240210","L. Lukšan","1986","http://link.springer.com/article/10.1007/BF02240210","Article"
"On higher order centered forms","Computing","","35","2","10.1007/BF02260503","G. AlefeldR. Lohner","1985","http://link.springer.com/article/10.1007/BF02260503","Article"
"Classifier systems and the animat problem","Machine Learning","","2","3","10.1007/BF00058679","Stewart W. Wilson","1987","http://link.springer.com/article/10.1007/BF00058679","Article"
"Computer Art Forum","The Visual Computer","","2","5","10.1007/BF02020434","Nadia Magnenat-Thalmann","1986","http://link.springer.com/article/10.1007/BF02020434","Article"
"Announcement","Machine Learning","","2","3","10.1007/BF00058683","","1987","http://link.springer.com/article/10.1007/BF00058683","Article"
"ISOETRP clustering algorithm and its application to tree classifier design","Journal of Computer Science and Technology","","1","1","10.1007/BF02943303","Qingren Wang","1986","http://link.springer.com/article/10.1007/BF02943303","Article"
"Intimate machine interaction","The Visual Computer","","2","3","10.1007/BF01900325","Peter Beyls","1986","http://link.springer.com/article/10.1007/BF01900325","Article"
"Varying relaxation parameters in nonlinear successive overrelaxation","Computing","","34","1","10.1007/BF02242175","M. E. BrewsterR. Kannan","1985","http://link.springer.com/article/10.1007/BF02242175","Article"
"Editorial","Artificial Intelligence Review","","1","2","10.1007/BF00130009","Derek Partridge","1987","http://link.springer.com/article/10.1007/BF00130009","Article"
"An interval version of Shubert's iterative method for the localization of the global maximum","Computing","","38","3","10.1007/BF02240102","Prof. Z. ShenY. Zhu","1987","http://link.springer.com/article/10.1007/BF02240102","Article"
"Book reviews","Artificial Intelligence Review","","1","2","10.1007/BF00130013","S. TorranceA. -M. AllardiceS. Ross","1987","http://link.springer.com/article/10.1007/BF00130013","Article"
"On the monotonicity of the interval versions of Schulz's method II","Computing","","39","4","10.1007/BF02239979","Prof. Dr. Jürgen Herzberger","1987","http://link.springer.com/article/10.1007/BF02239979","Article"
"A high resolution Chinese character generator","Journal of Computer Science and Technology","","1","2","10.1007/BF02943267","Xuan WangZhimin LüYuhai TangYang Xiang","1986","http://link.springer.com/article/10.1007/BF02943267","Article"
"A structural operational semantics for an Edison like language (2)","Journal of Computer Science and Technology","","1","2","10.1007/BF02943271","Wei Li","1986","http://link.springer.com/article/10.1007/BF02943271","Article"
"A version space approach to learning context-free grammars","Machine Learning","","2","1","10.1007/BF00058754","Kurt VanlehnWilliam Ball","1987","http://link.springer.com/article/10.1007/BF00058754","Article"
"Verbesserung der Rundung bei der rationalen Arithmetik durch die Einführung von Nebennäherungsbrüchen","Computing","","36","3","10.1007/BF02240066","M. Kaiserswerth","1986","http://link.springer.com/article/10.1007/BF02240066","Article"
"On the structure of (weak) inverses of an (weakly) invertible finite automaton","Journal of Computer Science and Technology","","1","3","10.1007/BF02979465","Shihua Chen","1986","http://link.springer.com/article/10.1007/BF02979465","Article"
"AND parallelism and nondeterminism in logic programs","New Generation Computing","","3","1","10.1007/BF03037115","John S. ConeryDennis F. Kibler","1985","http://link.springer.com/article/10.1007/BF03037115","Article"
"Terminology: Principles and methdos","Computers and translation","","2","2 - 3","10.1007/BF02274438","wayne D. Cole","1987","http://link.springer.com/article/10.1007/BF02274438","Article"
"On the simultaneous determination of zeros of analytic or sectionally analytic functions","Computing","","36","3","10.1007/BF02240070","Prof. Dr. N. I. IoakimidisMrs. E. G. Anastasselou","1986","http://link.springer.com/article/10.1007/BF02240070","Article"
"Book reviews","Computers and translation","","2","2 - 3","10.1007/BF02274442","Sheila M. EmbletonMargaret S. Woodruff-Wieding","1987","http://link.springer.com/article/10.1007/BF02274442","Article"
"Negation as Failure. Completeness of the Query Evaluation Process for horn clause programs with recursive definitions","Journal of Automated Reasoning","","2","2","10.1007/BF02432149","C. AquilanoR. BarbutiP. BocchettiM. Martelli","1986","http://link.springer.com/article/10.1007/BF02432149","Article"
"Multi-layer logic — A predicate logic including data structure as knowledge representation language","New Generation Computing","","3","4","10.1007/BF03037079","Setsuo OhsugaHiroyuki Yamauchi","1985","http://link.springer.com/article/10.1007/BF03037079","Article"
"Evolutional multiplication of software environments","New Generation Computing","","4","2","10.1007/BF03037437","Yutaka Ohno","1986","http://link.springer.com/article/10.1007/BF03037437","Article"
"Announcing a new journal","Journal of Automated Reasoning","","2","2","10.1007/BF02432153","","1986","http://link.springer.com/article/10.1007/BF02432153","Article"
